Filename,Score,Reason
Resume7.docx,Score: 9.5,"Reason: The resume has strong alignment with the job description for a Business Systems Analyst position. The candidate has extensive experience in data analysis, data modeling, and data warehousing, which are key skills required for this role. They have worked with various data sources and systems, including SQL server, Oracle, My SQL, MS Access, Excel, DB2, Teradata, and SAS. The candidate has also demonstrated expertise in SQL, data analysis, and data validation. They have experience in leading and participating in system and application walk-throughs and possess strong oral and written communication skills. The candidate has also worked in Agile methodologies, which is a nice-to-have skill for this role. However, the candidate's experience in creating and documenting process flows, business processes, and data classification is not explicitly mentioned in the resume, which could have earned them a higher score. Overall, the candidate's experience, skills"
Resume6.docx,9.5,"Reason: The resume has a strong alignment with the job description with extensive experience in data analysis, systems analysis, design, business intelligence solutions, development, testing, implementation and support of Enterprise Data Warehouse (EDW) with expertise in gathering and documenting business requirements. The candidate has experience in various SDLC methodologies, including Agile, Scrum, Waterfall, and Hybrid. They have technical skills in various platforms, testing tools, change management tools, office tools, databases, languages, ETL tools, and reporting tools that match the job requirements. The candidate has experience in leading and participating in system and application walk-throughs, collaborating in designing integration interfaces between systems, and creating system integration documentation. They possess strong oral and written communication skills, which is a critical skill for the role of a Business Systems Analyst. The candidate has experience working in the logistics and airlines industries, which is a plus for"
Resume5.docx,9.5,"reason = The resume has strong alignment with the job description, showcasing extensive experience in data analysis, ETL testing, and process improvement. The candidate demonstrates proficiency in HL7 and FHIR messaging standards, healthcare regulations, and quality measurement. They have worked with various healthcare systems and tools, including Epic, SQL, Python, R, Tableau, and Power BI. The candidate also shows expertise in data modeling, data migration, and data visualization. However, the job description emphasizes process flow, business process, and data classification, for which the resume could provide more focused examples and skills. The candidate's experience in Agile methodologies is mentioned, but specific experience with Kanban and Scrum would strengthen their application."
Resume4.docx,8.5,"Reason:

The resume is well-structured and showcases extensive experience in software quality assurance engineering, with a strong focus on Agile methodologies and various SDLC models. The candidate has demonstrated skills in creating test cases, executing test cases, and reporting test design/execution metrics, which align well with the job description's requirements for process flow creation, business process analysis, and documentation.

The candidate's experience in working with various tools and technologies, such as Jira, Spira, Bitbucket, Git, YAML files, Visual Studio, TFS, and SQL Server, is a significant advantage. The candidate's proficiency in programming languages like VB6/VB.Net, C#, and SQL queries is also noteworthy.

However, the resume lacks specific accomplishments or achievements in business systems analysis or process improvement. Although the candidate has experience in gathering business"
Resume2.docx,9.5,"Reason: The resume has strong alignment with the job description, showcasing around 8 years of experience as a Business Analyst in the healthcare domain. The candidate has demonstrated skills in all phases of the SDLC, gathering functional and non-functional requirements, preparing BRDs, working with Agile methodologies, and addressing compliance challenges. They have experience in healthcare data analysis, ETL processes, data modeling, and designing interactive dashboards. The candidate also has a deep understanding of medication reconciliation processes and clinical decision support systems.

The resume is well-structured, and the candidate has highlighted their achievements with quantifiable metrics. They have shown adaptability and flexibility by working with various clients and technologies. The candidate has also demonstrated strong language proficiency and professional development through their publications and presentations.

However, the candidate could improve their score by customizing the resume more specifically to the job description, using keywords and buzzwords"
Resume8.docx,9.5,"Reason:

* Relevance to Job Description: 9.5 (The candidate has extensive experience in business analysis, financial management, planning, and strategy, which aligns well with the job description.)
* Experience: 9.5 (With 8 years of experience in the financial and e-commerce sector, the candidate has a solid background in the required field.)
* Achievements and Accomplishments: Not explicitly mentioned in the resume, but the detailed work experience section implies several accomplishments. (0.5 deducted)
* Skills and Competencies: 9.5 (The candidate has demonstrated proficiency in various technical and soft skills required for the job.)
* Quantifiable Metrics: Not explicitly mentioned, but the candidate has provided examples of increased efficiency and profitability. (0.5 deducted)
* Education and Qualifications: Not explicitly mentioned, but the"
Resume3.docx,8.5,"Reason: The resume has a strong alignment with the job description, with extensive experience in automated testing, system and regression testing, and UAT testing. The candidate has demonstrated expertise in Selenium WebDriver, Java, JUnit, TestNG, Maven, Jenkins, GitHub, SQL, and various other technical skills that are required for the Business Systems Analyst role. The candidate has also implemented different automation frameworks such as POM, Hybrid, and Data Driven framework, which is a plus. However, the job description emphasizes more on analyzing business applications and documenting workflows, business processes, and system interactions, which requires strong communication skills. Although the candidate has mentioned possessing strong oral and written communication skills, there is no concrete example or achievement that highlights this skill. Therefore, the score is slightly lower than a perfect 10."
Resume1.docx,9.5,"Reason: The resume is highly aligned with the job description, showcasing extensive experience and skills in business systems analysis, particularly in the banking sector. The candidate has demonstrated expertise in various software development lifecycle methodologies, compliance and regulations, risk management, and stakeholder management. They have also showcased their skills in requirements gathering, documentation, and collaboration with various teams. The candidate has a strong background in data modeling, database management, and testing environments. They have also worked with various interactive and collaboration tools, business intelligence tools, and agile DevOps. The candidate's experience in conducting gap analysis, cost-benefit analysis, feasibility study, and stakeholder analysis is a significant plus. However, the candidate's experience in leading and participating in system and application walk-throughs and experience with Agile Methodologies (Kanban and Scrum) is not explicitly mentioned, which is why they are marked down slightly."
Resume10.docx,9.5,"reason = The resume has strong alignment with the job description, showcasing 12+ years of experience as a business analyst in the healthcare industry. The candidate has extensive expertise in claims, billing, reimbursement, and RPA, as well as hands-on experience with Oracle CRM. They have demonstrated skills in utilizing Facets, conducting performance analysis, providing user support, and implementing change management strategies. The candidate also has knowledge of healthcare regulations, CMS interoperability standards, and various subsystems of MMIS. However, the score is slightly reduced due to the lack of customization for the specific job description and the absence of keywords and buzzwords related to the Business Systems Analyst role."
Resume9.docx,9.5,"Reason: The resume has strong alignment with the job description for the Business Systems Analyst position. The candidate has extensive experience in data analysis, design, development, and implementation of business intelligence projects, which is directly relevant to the role. They have also demonstrated skills in analyzing business applications and documenting workflows, as well as experience in leading and participating in system and application walk-throughs. The candidate's expertise in SQL and Python, as well as their experience with ETL processes and data visualization, are also relevant to the role. The candidate has a strong educational background with a Master's in Public Health, which is relevant to the healthcare focus of the role. The candidate has also demonstrated experience in leading analysis and solution definition, as well as understanding the business issues and data challenges of an organization. The candidate has a demonstrated ability to identify an organization's strengths and weaknesses and suggest areas of improvement. The candidate has also"
